instruction,input,output,category,text
What acquisitions should I consider?,,"Options include bootstrapping, angel investors, venture capital, crowdfunding, debt financing, grants, and strategic partnerships. Choose based on your stage and needs.",investment_ready,"### Instruction: What acquisitions should I consider?
### Response: Options include bootstrapping, angel investors, venture capital, crowdfunding, debt financing, grants, and strategic partnerships. Choose based on your stage and needs."
How do I manage investor relations?,,"Network through industry events, accelerators, online platforms like AngelList, warm introductions from other entrepreneurs, and angel investor groups in your area.",investment_ready,"### Instruction: How do I manage investor relations?
### Response: Network through industry events, accelerators, online platforms like AngelList, warm introductions from other entrepreneurs, and angel investor groups in your area."
What governance structures do I need?,,"Expect review of financials, legal documents, customer references, technical architecture, IP portfolio, team backgrounds, and market analysis. Prepare comprehensive documentation.",investment_ready,"### Instruction: What governance structures do I need?
### Response: Expect review of financials, legal documents, customer references, technical architecture, IP portfolio, team backgrounds, and market analysis. Prepare comprehensive documentation."
How do I handle market competition at scale?,,"Hire for culture fit and growth potential, implement scalable HR processes, create clear role definitions, establish performance management systems, and maintain team cohesion.",investment_ready,"### Instruction: How do I handle market competition at scale?
### Response: Hire for culture fit and growth potential, implement scalable HR processes, create clear role definitions, establish performance management systems, and maintain team cohesion."
What are the signs of product-market fit?,,"Focus on North Star metrics like revenue, user growth, retention, NPS scores, market share, operational efficiency, and team performance indicators that drive long-term value.",investment_ready,"### Instruction: What are the signs of product-market fit?
### Response: Focus on North Star metrics like revenue, user growth, retention, NPS scores, market share, operational efficiency, and team performance indicators that drive long-term value."
How do I pivot my business model?,,"Analyze what's not working, gather customer feedback, explore adjacent markets, test new business models, and be prepared to make significant changes to find product-market fit.",needs_refinement,"### Instruction: How do I pivot my business model?
### Response: Analyze what's not working, gather customer feedback, explore adjacent markets, test new business models, and be prepared to make significant changes to find product-market fit."
What should I do if my product isn't selling?,,"Conduct customer interviews to understand why they're not buying, analyze your value proposition, review your pricing strategy, improve your marketing message, and consider product improvements.",needs_refinement,"### Instruction: What should I do if my product isn't selling?
### Response: Conduct customer interviews to understand why they're not buying, analyze your value proposition, review your pricing strategy, improve your marketing message, and consider product improvements."
How do I improve customer retention?,,"Analyze churn reasons, improve onboarding, create customer success programs, gather regular feedback, build loyalty programs, and focus on delivering consistent value.",needs_refinement,"### Instruction: How do I improve customer retention?
### Response: Analyze churn reasons, improve onboarding, create customer success programs, gather regular feedback, build loyalty programs, and focus on delivering consistent value."
What if my target market is too small?,,"Consider expanding your target market, finding niche applications, exploring B2B opportunities, or pivoting to adjacent markets with larger addressable audiences.",needs_refinement,"### Instruction: What if my target market is too small?
### Response: Consider expanding your target market, finding niche applications, exploring B2B opportunities, or pivoting to adjacent markets with larger addressable audiences."
How do I fix poor unit economics?,,"Analyze your cost structure, improve pricing strategy, optimize customer acquisition channels, reduce churn, increase customer lifetime value, and eliminate unprofitable segments.",needs_refinement,"### Instruction: How do I fix poor unit economics?
### Response: Analyze your cost structure, improve pricing strategy, optimize customer acquisition channels, reduce churn, increase customer lifetime value, and eliminate unprofitable segments."
What should I do about negative customer feedback?,,"Listen carefully to feedback, identify patterns, prioritize critical issues, communicate your improvement plans, and show customers you value their input through action.",needs_refinement,"### Instruction: What should I do about negative customer feedback?
### Response: Listen carefully to feedback, identify patterns, prioritize critical issues, communicate your improvement plans, and show customers you value their input through action."
How do I revise my value proposition?,,"Conduct fresh customer interviews, analyze successful competitors, test new messaging, focus on unique benefits, and ensure your value proposition addresses real customer pain points.",needs_refinement,"### Instruction: How do I revise my value proposition?
### Response: Conduct fresh customer interviews, analyze successful competitors, test new messaging, focus on unique benefits, and ensure your value proposition addresses real customer pain points."
What if my competition is outperforming me?,,"Analyze their advantages, identify your unique strengths, improve your product differentiation, enhance customer experience, optimize your marketing, or find underserved niches.",needs_refinement,"### Instruction: What if my competition is outperforming me?
### Response: Analyze their advantages, identify your unique strengths, improve your product differentiation, enhance customer experience, optimize your marketing, or find underserved niches."
How do I improve my product features?,,"Prioritize features based on customer feedback, conduct usability testing, implement agile development processes, gather continuous feedback, and focus on core functionality first.",needs_refinement,"### Instruction: How do I improve my product features?
### Response: Prioritize features based on customer feedback, conduct usability testing, implement agile development processes, gather continuous feedback, and focus on core functionality first."
What should I do if I'm running out of funding?,,"Extend your runway through cost reduction, explore revenue-based financing, pitch to new investors, consider strategic partnerships, or pursue grants and competitions.",needs_refinement,"### Instruction: What should I do if I'm running out of funding?
### Response: Extend your runway through cost reduction, explore revenue-based financing, pitch to new investors, consider strategic partnerships, or pursue grants and competitions."
How do I reduce customer acquisition costs?,,"Optimize your marketing channels, improve conversion rates, enhance referral programs, focus on organic growth strategies, and analyze customer lifetime value to justify acquisition costs.",needs_refinement,"### Instruction: How do I reduce customer acquisition costs?
### Response: Optimize your marketing channels, improve conversion rates, enhance referral programs, focus on organic growth strategies, and analyze customer lifetime value to justify acquisition costs."
What if my team isn't performing well?,,"Assess team members individually, provide additional training or support, clarify roles and expectations, consider team restructuring, and focus on cultural fit and performance.",needs_refinement,"### Instruction: What if my team isn't performing well?
### Response: Assess team members individually, provide additional training or support, clarify roles and expectations, consider team restructuring, and focus on cultural fit and performance."
How do I improve my marketing strategy?,,"Analyze your current strategy's performance, test new channels, improve your messaging, enhance your brand positioning, and focus on channels with the best ROI.",needs_refinement,"### Instruction: How do I improve my marketing strategy?
### Response: Analyze your current strategy's performance, test new channels, improve your messaging, enhance your brand positioning, and focus on channels with the best ROI."
What should I do about technical debt?,,"Prioritize critical issues, allocate time for refactoring, implement better development practices, consider bringing in technical expertise, and balance new features with improvements.",needs_refinement,"### Instruction: What should I do about technical debt?
### Response: Prioritize critical issues, allocate time for refactoring, implement better development practices, consider bringing in technical expertise, and balance new features with improvements."
How do I handle a failing partnership?,,"Evaluate the partnership's strategic value, communicate issues openly, renegotiate terms if needed, or consider ending partnerships that aren't delivering mutual value.",needs_refinement,"### Instruction: How do I handle a failing partnership?
### Response: Evaluate the partnership's strategic value, communicate issues openly, renegotiate terms if needed, or consider ending partnerships that aren't delivering mutual value."
What if my business model isn't sustainable?,,"Review your unit economics, explore new revenue streams, reduce operational costs, improve customer lifetime value, and consider fundamental business model changes.",needs_refinement,"### Instruction: What if my business model isn't sustainable?
### Response: Review your unit economics, explore new revenue streams, reduce operational costs, improve customer lifetime value, and consider fundamental business model changes."
How do I improve operational efficiency?,,"Identify bottlenecks, automate repetitive processes, implement better tools and systems, optimize workflows, and continuously measure and improve key operational metrics.",needs_refinement,"### Instruction: How do I improve operational efficiency?
### Response: Identify bottlenecks, automate repetitive processes, implement better tools and systems, optimize workflows, and continuously measure and improve key operational metrics."
What should I do about low conversion rates?,,"Analyze your funnel, A/B test different approaches, improve your value proposition, optimize your website and marketing materials, and remove friction from the conversion process.",needs_refinement,"### Instruction: What should I do about low conversion rates?
### Response: Analyze your funnel, A/B test different approaches, improve your value proposition, optimize your website and marketing materials, and remove friction from the conversion process."
How do I fix pricing strategy issues?,,"Analyze competitor pricing, survey your customers about price sensitivity, test different pricing models, consider value-based pricing, and ensure your pricing reflects your value.",needs_refinement,"### Instruction: How do I fix pricing strategy issues?
### Response: Analyze competitor pricing, survey your customers about price sensitivity, test different pricing models, consider value-based pricing, and ensure your pricing reflects your value."
What if my market positioning is wrong?,,"Conduct new market research, test different positioning messages, analyze successful competitors, and consider repositioning around different customer segments or value propositions.",needs_refinement,"### Instruction: What if my market positioning is wrong?
### Response: Conduct new market research, test different positioning messages, analyze successful competitors, and consider repositioning around different customer segments or value propositions."
How do I improve customer satisfaction?,,"Analyze what's not working, gather customer feedback, explore adjacent markets, test new business models, and be prepared to make significant changes to find product-market fit.",needs_refinement,"### Instruction: How do I improve customer satisfaction?
### Response: Analyze what's not working, gather customer feedback, explore adjacent markets, test new business models, and be prepared to make significant changes to find product-market fit."
What should I do about high churn rates?,,"Conduct customer interviews to understand why they're not buying, analyze your value proposition, review your pricing strategy, improve your marketing message, and consider product improvements.",needs_refinement,"### Instruction: What should I do about high churn rates?
### Response: Conduct customer interviews to understand why they're not buying, analyze your value proposition, review your pricing strategy, improve your marketing message, and consider product improvements."
How do I optimize my supply chain?,,"Analyze churn reasons, improve onboarding, create customer success programs, gather regular feedback, build loyalty programs, and focus on delivering consistent value.",needs_refinement,"### Instruction: How do I optimize my supply chain?
### Response: Analyze churn reasons, improve onboarding, create customer success programs, gather regular feedback, build loyalty programs, and focus on delivering consistent value."
What if my product roadmap is unclear?,,"Consider expanding your target market, finding niche applications, exploring B2B opportunities, or pivoting to adjacent markets with larger addressable audiences.",needs_refinement,"### Instruction: What if my product roadmap is unclear?
### Response: Consider expanding your target market, finding niche applications, exploring B2B opportunities, or pivoting to adjacent markets with larger addressable audiences."
How do I improve team communication?,,"Analyze your cost structure, improve pricing strategy, optimize customer acquisition channels, reduce churn, increase customer lifetime value, and eliminate unprofitable segments.",needs_refinement,"### Instruction: How do I improve team communication?
### Response: Analyze your cost structure, improve pricing strategy, optimize customer acquisition channels, reduce churn, increase customer lifetime value, and eliminate unprofitable segments."
What should I do about regulatory challenges?,,"Listen carefully to feedback, identify patterns, prioritize critical issues, communicate your improvement plans, and show customers you value their input through action.",needs_refinement,"### Instruction: What should I do about regulatory challenges?
### Response: Listen carefully to feedback, identify patterns, prioritize critical issues, communicate your improvement plans, and show customers you value their input through action."
How do I fix brand reputation issues?,,"Conduct fresh customer interviews, analyze successful competitors, test new messaging, focus on unique benefits, and ensure your value proposition addresses real customer pain points.",needs_refinement,"### Instruction: How do I fix brand reputation issues?
### Response: Conduct fresh customer interviews, analyze successful competitors, test new messaging, focus on unique benefits, and ensure your value proposition addresses real customer pain points."
What if my growth has stagnated?,,"Analyze their advantages, identify your unique strengths, improve your product differentiation, enhance customer experience, optimize your marketing, or find underserved niches.",needs_refinement,"### Instruction: What if my growth has stagnated?
### Response: Analyze their advantages, identify your unique strengths, improve your product differentiation, enhance customer experience, optimize your marketing, or find underserved niches."
How do I improve cash flow management?,,"Prioritize features based on customer feedback, conduct usability testing, implement agile development processes, gather continuous feedback, and focus on core functionality first.",needs_refinement,"### Instruction: How do I improve cash flow management?
### Response: Prioritize features based on customer feedback, conduct usability testing, implement agile development processes, gather continuous feedback, and focus on core functionality first."
What should I do about market timing issues?,,"Extend your runway through cost reduction, explore revenue-based financing, pitch to new investors, consider strategic partnerships, or pursue grants and competitions.",needs_refinement,"### Instruction: What should I do about market timing issues?
### Response: Extend your runway through cost reduction, explore revenue-based financing, pitch to new investors, consider strategic partnerships, or pursue grants and competitions."
I'm a first-time founder with a SaaS idea for small businesses. I've built a prototype but haven't gotten any paying customers yet. What should I focus on?,,"Based on your stage, you're in the 'Mentorship Needed' category. Focus on customer discovery first - reach out to 50+ small business owners to validate your problem hypothesis. Don't just ask if they like your solution; ask about their current workflows and pain points. Once you understand their needs better, refine your prototype to address the most critical issues. Then, offer a free trial or pilot program to gather real usage data and feedback. Remember, at this stage, learning is more valuable than revenue.",mentorship_needed,"### Instruction: I'm a first-time founder with a SaaS idea for small businesses. I've built a prototype but haven't gotten any paying customers yet. What should I focus on?
### Response: Based on your stage, you're in the 'Mentorship Needed' category. Focus on customer discovery first - reach out to 50+ small business owners to validate your problem hypothesis. Don't just ask if they like your solution; ask about their current workflows and pain points. Once you understand their needs better, refine your prototype to address the most critical issues. Then, offer a free trial or pilot program to gather real usage data and feedback. Remember, at this stage, learning is more valuable than revenue."
"My startup has $2M ARR, 40% YoY growth, and strong unit economics. I want to raise Series A to scale our sales team and expand internationally. How should I prepare?",,"Congratulations! You're clearly 'Investment Ready'. For Series A preparation, focus on: 1) Financial metrics: Ensure your LTV/CAC ratio is >3, gross margin >70%, and net revenue retention >100%. 2) Create a compelling pitch deck highlighting your TAM expansion, competitive moats, and international expansion strategy. 3) Build relationships with tier-1 VCs 6 months before fundraising. 4) Prepare detailed financial projections showing path to $10M+ ARR. 5) Document your go-to-market playbook to demonstrate repeatability. Target $5-15M raise based on your metrics and market opportunity.",investment_ready,"### Instruction: My startup has $2M ARR, 40% YoY growth, and strong unit economics. I want to raise Series A to scale our sales team and expand internationally. How should I prepare?
### Response: Congratulations! You're clearly 'Investment Ready'. For Series A preparation, focus on: 1) Financial metrics: Ensure your LTV/CAC ratio is >3, gross margin >70%, and net revenue retention >100%. 2) Create a compelling pitch deck highlighting your TAM expansion, competitive moats, and international expansion strategy. 3) Build relationships with tier-1 VCs 6 months before fundraising. 4) Prepare detailed financial projections showing path to $10M+ ARR. 5) Document your go-to-market playbook to demonstrate repeatability. Target $5-15M raise based on your metrics and market opportunity."
"Our startup launched 18 months ago but we're struggling with high churn rates (15% monthly), low conversion from trial to paid (2%), and our CAC is higher than our LTV. What should we do?",,"Your startup falls into the 'Needs Refinement' category and requires immediate attention to unit economics. Here's a systematic approach: 1) Churn Analysis: Interview churned customers to identify patterns - is it product fit, onboarding, or value realization? 2) Conversion Optimization: Analyze your trial-to-paid funnel, improve onboarding experience, and add more value during trial period. 3) Cost Reduction: Pause expensive acquisition channels, focus on organic growth and referrals. 4) Product-Market Fit: You may need to pivot your target market or core features. 5) Consider a strategic pause on growth to fix fundamentals. These metrics suggest fundamental issues that need addressing before scaling further.",needs_refinement,"### Instruction: Our startup launched 18 months ago but we're struggling with high churn rates (15% monthly), low conversion from trial to paid (2%), and our CAC is higher than our LTV. What should we do?
### Response: Your startup falls into the 'Needs Refinement' category and requires immediate attention to unit economics. Here's a systematic approach: 1) Churn Analysis: Interview churned customers to identify patterns - is it product fit, onboarding, or value realization? 2) Conversion Optimization: Analyze your trial-to-paid funnel, improve onboarding experience, and add more value during trial period. 3) Cost Reduction: Pause expensive acquisition channels, focus on organic growth and referrals. 4) Product-Market Fit: You may need to pivot your target market or core features. 5) Consider a strategic pause on growth to fix fundamentals. These metrics suggest fundamental issues that need addressing before scaling further."
What opportunities exist for startups in Rwanda's economy?,,"Rwanda offers excellent opportunities in fintech (mobile payments, digital banking), agritech (supporting smallholder farmers), healthtech (telemedicine, health records), edtech (digital learning platforms), and tourism tech. The government's Vision 2050 and digital transformation agenda provide strong support for tech startups. Focus on solutions that address local challenges while being scalable regionally.",mentorship_needed,"### Instruction: What opportunities exist for startups in Rwanda's economy?
### Response: Rwanda offers excellent opportunities in fintech (mobile payments, digital banking), agritech (supporting smallholder farmers), healthtech (telemedicine, health records), edtech (digital learning platforms), and tourism tech. The government's Vision 2050 and digital transformation agenda provide strong support for tech startups. Focus on solutions that address local challenges while being scalable regionally."
How can I access funding for my startup in East Africa?,,"East Africa has a growing funding ecosystem. Consider: 1) Local VCs like Knife Capital, TLcom Capital, and Novastar Ventures. 2) Development finance institutions like IFC and CDC. 3) Accelerators such as Seedstars, GSMA Ecosystem Accelerator, and local programs. 4) Grants from organizations like USAID, GIZ, and the World Bank. 5) Regional startup competitions and pitch events. Build strong local networks and focus on solving problems relevant to the East African market.",investment_ready,"### Instruction: How can I access funding for my startup in East Africa?
### Response: East Africa has a growing funding ecosystem. Consider: 1) Local VCs like Knife Capital, TLcom Capital, and Novastar Ventures. 2) Development finance institutions like IFC and CDC. 3) Accelerators such as Seedstars, GSMA Ecosystem Accelerator, and local programs. 4) Grants from organizations like USAID, GIZ, and the World Bank. 5) Regional startup competitions and pitch events. Build strong local networks and focus on solving problems relevant to the East African market."
Should I build my MVP using no-code tools or custom development?,,"For early validation, no-code tools like Bubble, Webflow, or Airtable can be excellent for MVPs. They allow rapid iteration and cost-effective testing. However, consider custom development if: 1) Your product requires complex algorithms, 2) You need specific integrations, 3) Performance is critical, or 4) You plan to scale rapidly. Many successful startups started with no-code MVPs and rebuilt later. Focus on learning about your customers first, optimize for technical elegance second.",mentorship_needed,"### Instruction: Should I build my MVP using no-code tools or custom development?
### Response: For early validation, no-code tools like Bubble, Webflow, or Airtable can be excellent for MVPs. They allow rapid iteration and cost-effective testing. However, consider custom development if: 1) Your product requires complex algorithms, 2) You need specific integrations, 3) Performance is critical, or 4) You plan to scale rapidly. Many successful startups started with no-code MVPs and rebuilt later. Focus on learning about your customers first, optimize for technical elegance second."
