instruction,input,output,category,text
My startup is growing fast but profitability is declining. What's wrong?,,"Declining profitability during growth often indicates unit economics problems: 1) Customer acquisition costs rising faster than lifetime value, 2) Increased operational complexity creating inefficiencies, 3) Price competition forcing margin compression, 4) Infrastructure costs scaling non-linearly, 5) Quality issues leading to higher support costs. Immediate actions: audit your unit economics by cohort, identify which growth channels are profitable, optimize your highest-volume processes, and consider raising prices or reducing costs. Sometimes slowing growth to fix fundamentals is better than scaling unprofitably. Focus on sustainable growth over vanity metrics.",needs_refinement,"### Instruction: My startup is growing fast but profitability is declining. What's wrong?
### Response: Declining profitability during growth often indicates unit economics problems: 1) Customer acquisition costs rising faster than lifetime value, 2) Increased operational complexity creating inefficiencies, 3) Price competition forcing margin compression, 4) Infrastructure costs scaling non-linearly, 5) Quality issues leading to higher support costs. Immediate actions: audit your unit economics by cohort, identify which growth channels are profitable, optimize your highest-volume processes, and consider raising prices or reducing costs. Sometimes slowing growth to fix fundamentals is better than scaling unprofitably. Focus on sustainable growth over vanity metrics."
A key team member just left during a critical project. How do I handle this?,,"Losing a key team member during a critical project requires immediate action: 1) Assess impact - what knowledge, relationships, and work will be lost?, 2) Secure assets - ensure all work, passwords, and IP are transferred, 3) Communicate transparently - tell the team and stakeholders honestly, 4) Redistribute work - identify who can cover critical functions temporarily, 5) Accelerate hiring - start recruiting immediately for permanent replacement, 6) Learn from exit - understand why they left to prevent future departures. Consider hiring contractors or consultants for immediate gaps. Use this as an opportunity to document processes and reduce single points of failure.",needs_refinement,"### Instruction: A key team member just left during a critical project. How do I handle this?
### Response: Losing a key team member during a critical project requires immediate action: 1) Assess impact - what knowledge, relationships, and work will be lost?, 2) Secure assets - ensure all work, passwords, and IP are transferred, 3) Communicate transparently - tell the team and stakeholders honestly, 4) Redistribute work - identify who can cover critical functions temporarily, 5) Accelerate hiring - start recruiting immediately for permanent replacement, 6) Learn from exit - understand why they left to prevent future departures. Consider hiring contractors or consultants for immediate gaps. Use this as an opportunity to document processes and reduce single points of failure."
We just discovered a major security breach in our product. What should we do?,,"A security breach requires immediate, systematic response: 1) Contain the breach - stop ongoing access and secure systems, 2) Assess impact - understand what data was accessed and which users affected, 3) Legal compliance - notify authorities as required (GDPR, etc.), 4) Customer communication - inform affected users transparently and quickly, 5) Fix vulnerabilities - patch the security holes and improve systems, 6) External help - engage security experts and legal counsel. Be transparent about what happened, what you're doing to fix it, and how you'll prevent future breaches. Your response will define customer trust going forward. Consider this a learning opportunity to build better security practices.",needs_refinement,"### Instruction: We just discovered a major security breach in our product. What should we do?
### Response: A security breach requires immediate, systematic response: 1) Contain the breach - stop ongoing access and secure systems, 2) Assess impact - understand what data was accessed and which users affected, 3) Legal compliance - notify authorities as required (GDPR, etc.), 4) Customer communication - inform affected users transparently and quickly, 5) Fix vulnerabilities - patch the security holes and improve systems, 6) External help - engage security experts and legal counsel. Be transparent about what happened, what you're doing to fix it, and how you'll prevent future breaches. Your response will define customer trust going forward. Consider this a learning opportunity to build better security practices."
How do I navigate regulatory requirements for a fintech startup?,,"Fintech regulatory compliance is complex but manageable with the right approach: 1) Identify applicable regulations - banking, securities, anti-money laundering, data protection, 2) Engage legal experts early - don't try to navigate this alone, 3) Build compliance into your product - design systems to meet regulatory requirements from day one, 4) Establish relationships with regulators - participate in regulatory sandboxes if available, 5) Plan for licensing - understand timeline and costs for required licenses, 6) Consider partnerships - work with licensed institutions to reduce regulatory burden. Start with legal research and expert consultation before building. Compliance costs should be factored into your financial planning and fundraising.",mentorship_needed,"### Instruction: How do I navigate regulatory requirements for a fintech startup?
### Response: Fintech regulatory compliance is complex but manageable with the right approach: 1) Identify applicable regulations - banking, securities, anti-money laundering, data protection, 2) Engage legal experts early - don't try to navigate this alone, 3) Build compliance into your product - design systems to meet regulatory requirements from day one, 4) Establish relationships with regulators - participate in regulatory sandboxes if available, 5) Plan for licensing - understand timeline and costs for required licenses, 6) Consider partnerships - work with licensed institutions to reduce regulatory burden. Start with legal research and expert consultation before building. Compliance costs should be factored into your financial planning and fundraising."
What's unique about building a B2B SaaS startup versus other business models?,,"B2B SaaS has distinct characteristics that affect strategy: 1) Longer sales cycles - expect 3-18 months from first contact to close, 2) Higher customer lifetime values - justify more expensive acquisition approaches, 3) Recurring revenue - focus on retention and expansion over new customer acquisition, 4) Product stickiness - switching costs create competitive advantages, 5) Enterprise needs - security, integrations, and customization become critical. Key metrics differ too - focus on MRR, churn, expansion revenue, and customer health scores rather than just user growth. The path to product-market fit involves deeper customer relationships and more complex implementation cycles, but the reward is predictable, scalable revenue.",mentorship_needed,"### Instruction: What's unique about building a B2B SaaS startup versus other business models?
### Response: B2B SaaS has distinct characteristics that affect strategy: 1) Longer sales cycles - expect 3-18 months from first contact to close, 2) Higher customer lifetime values - justify more expensive acquisition approaches, 3) Recurring revenue - focus on retention and expansion over new customer acquisition, 4) Product stickiness - switching costs create competitive advantages, 5) Enterprise needs - security, integrations, and customization become critical. Key metrics differ too - focus on MRR, churn, expansion revenue, and customer health scores rather than just user growth. The path to product-market fit involves deeper customer relationships and more complex implementation cycles, but the reward is predictable, scalable revenue."
I'm feeling burned out as a founder. How do I deal with this?,,"Founder burnout is incredibly common and needs immediate attention: 1) Acknowledge it's real - burnout isn't a weakness, it's a signal, 2) Take breaks - even short ones can help reset your perspective, 3) Delegate more - identify tasks only you can do vs. tasks others can handle, 4) Build support systems - join founder groups, find mentors, or get professional help, 5) Reassess priorities - what really needs your attention right now?, 6) Exercise and sleep - physical health directly affects mental resilience. Remember, taking care of yourself isn't selfish - your startup needs you at your best. Consider it an investment in your company's success. If burnout persists, taking a longer break might be necessary.",mentorship_needed,"### Instruction: I'm feeling burned out as a founder. How do I deal with this?
### Response: Founder burnout is incredibly common and needs immediate attention: 1) Acknowledge it's real - burnout isn't a weakness, it's a signal, 2) Take breaks - even short ones can help reset your perspective, 3) Delegate more - identify tasks only you can do vs. tasks others can handle, 4) Build support systems - join founder groups, find mentors, or get professional help, 5) Reassess priorities - what really needs your attention right now?, 6) Exercise and sleep - physical health directly affects mental resilience. Remember, taking care of yourself isn't selfish - your startup needs you at your best. Consider it an investment in your company's success. If burnout persists, taking a longer break might be necessary."
Should I quit my day job to focus on my startup full-time?,,"The timing for going full-time depends on several factors: 1) Financial runway - do you have 6-12 months of expenses saved?, 2) Business traction - are you seeing consistent customer demand?, 3) Time constraints - is your day job preventing meaningful progress?, 4) Risk tolerance - can you handle the financial and emotional uncertainty?, 5) Family situation - do you have dependents or major financial obligations?. Consider a gradual transition - reduce to part-time, take unpaid leave, or negotiate flexible arrangements first. The goal is having enough time to make real progress while maintaining financial stability. There's no shame in keeping your day job longer if needed - better to build sustainably than risk everything prematurely.",mentorship_needed,"### Instruction: Should I quit my day job to focus on my startup full-time?
### Response: The timing for going full-time depends on several factors: 1) Financial runway - do you have 6-12 months of expenses saved?, 2) Business traction - are you seeing consistent customer demand?, 3) Time constraints - is your day job preventing meaningful progress?, 4) Risk tolerance - can you handle the financial and emotional uncertainty?, 5) Family situation - do you have dependents or major financial obligations?. Consider a gradual transition - reduce to part-time, take unpaid leave, or negotiate flexible arrangements first. The goal is having enough time to make real progress while maintaining financial stability. There's no shame in keeping your day job longer if needed - better to build sustainably than risk everything prematurely."
