instruction,input,output,category,text
How do I choose the right technology stack for my startup?,,"Choose your tech stack based on: 1) Team expertise - use what your team knows well, 2) Speed to market - prioritize rapid development, 3) Scalability needs - plan for growth but don't over-engineer, 4) Community and support - choose popular, well-documented technologies, 5) Hiring considerations - pick technologies that make it easier to find developers. Popular modern stacks include React/Node.js, Python/Django, or cloud-native solutions. Remember, you can always refactor later - the best technology is the one that helps you validate your business faster.",mentorship_needed,"### Instruction: How do I choose the right technology stack for my startup?
### Response: Choose your tech stack based on: 1) Team expertise - use what your team knows well, 2) Speed to market - prioritize rapid development, 3) Scalability needs - plan for growth but don't over-engineer, 4) Community and support - choose popular, well-documented technologies, 5) Hiring considerations - pick technologies that make it easier to find developers. Popular modern stacks include React/Node.js, Python/Django, or cloud-native solutions. Remember, you can always refactor later - the best technology is the one that helps you validate your business faster."
How do I create an effective sales process for my B2B startup?,,"Build a systematic B2B sales process: 1) Lead qualification using BANT (Budget, Authority, Need, Timeline), 2) Discovery calls to understand pain points, 3) Demo/presentation tailored to their specific needs, 4) Proposal with clear value proposition and ROI, 5) Negotiation and closing, 6) Onboarding and success tracking. Use a CRM to track every interaction. Start with a longer, consultative sales cycle and optimize for efficiency as you scale. Measure metrics like conversion rates at each stage, average deal size, and sales cycle length.",investment_ready,"### Instruction: How do I create an effective sales process for my B2B startup?
### Response: Build a systematic B2B sales process: 1) Lead qualification using BANT (Budget, Authority, Need, Timeline), 2) Discovery calls to understand pain points, 3) Demo/presentation tailored to their specific needs, 4) Proposal with clear value proposition and ROI, 5) Negotiation and closing, 6) Onboarding and success tracking. Use a CRM to track every interaction. Start with a longer, consultative sales cycle and optimize for efficiency as you scale. Measure metrics like conversion rates at each stage, average deal size, and sales cycle length."
My marketing campaigns aren't generating quality leads. What should I change?,,"Your lead quality issues suggest misalignment between messaging and audience. Review: 1) Target audience definition - are you reaching decision-makers?, 2) Value proposition clarity - does it address specific pain points?, 3) Content quality - is it educational rather than promotional?, 4) Channel selection - are you where your customers spend time?, 5) Lead qualification criteria - are you properly scoring leads?. Consider focusing on one channel first, creating better lead magnets, and implementing lead nurturing sequences. Quality over quantity - better to have 10 qualified leads than 100 unqualified ones.",needs_refinement,"### Instruction: My marketing campaigns aren't generating quality leads. What should I change?
### Response: Your lead quality issues suggest misalignment between messaging and audience. Review: 1) Target audience definition - are you reaching decision-makers?, 2) Value proposition clarity - does it address specific pain points?, 3) Content quality - is it educational rather than promotional?, 4) Channel selection - are you where your customers spend time?, 5) Lead qualification criteria - are you properly scoring leads?. Consider focusing on one channel first, creating better lead magnets, and implementing lead nurturing sequences. Quality over quantity - better to have 10 qualified leads than 100 unqualified ones."
How do I structure equity distribution among co-founders?,,"Founder equity should reflect contribution, risk, and future value. Consider: 1) Equal splits (25-25-25-25) for similar contributions, 2) Weighted splits based on role importance, experience, and time commitment, 3) Vesting schedules (typically 4 years with 1-year cliff) to protect against early departures, 4) Reserved equity pool (10-20%) for future employees, 5) Legal documentation through a lawyer. Common mistake: Don't wait too long to formalize. Use tools like the Founder Equity Calculator, but remember that fairness and team harmony are more important than perfect mathematical precision.",mentorship_needed,"### Instruction: How do I structure equity distribution among co-founders?
### Response: Founder equity should reflect contribution, risk, and future value. Consider: 1) Equal splits (25-25-25-25) for similar contributions, 2) Weighted splits based on role importance, experience, and time commitment, 3) Vesting schedules (typically 4 years with 1-year cliff) to protect against early departures, 4) Reserved equity pool (10-20%) for future employees, 5) Legal documentation through a lawyer. Common mistake: Don't wait too long to formalize. Use tools like the Founder Equity Calculator, but remember that fairness and team harmony are more important than perfect mathematical precision."
What financial metrics should I track at the seed stage?,,"At seed stage, focus on: 1) Burn rate and runway - how long can you survive?, 2) Customer acquisition metrics - CAC, conversion rates, organic vs paid growth, 3) Revenue metrics - MRR/ARR for SaaS, transaction volume for marketplaces, 4) Product engagement - DAU/MAU, feature usage, retention cohorts, 5) Unit economics - gross margin, contribution margin per customer. Don't overcomplicate - choose 5-7 key metrics that directly relate to your business model. Track weekly/monthly and focus on trends rather than absolute numbers. These metrics will become crucial for fundraising conversations.",investment_ready,"### Instruction: What financial metrics should I track at the seed stage?
### Response: At seed stage, focus on: 1) Burn rate and runway - how long can you survive?, 2) Customer acquisition metrics - CAC, conversion rates, organic vs paid growth, 3) Revenue metrics - MRR/ARR for SaaS, transaction volume for marketplaces, 4) Product engagement - DAU/MAU, feature usage, retention cohorts, 5) Unit economics - gross margin, contribution margin per customer. Don't overcomplicate - choose 5-7 key metrics that directly relate to your business model. Track weekly/monthly and focus on trends rather than absolute numbers. These metrics will become crucial for fundraising conversations."
How do I prioritize features when everything seems important?,,"Use a structured prioritization framework: 1) RICE scoring (Reach  Impact  Confidence  Effort), 2) Kano Model to distinguish must-haves from delighters, 3) Customer feedback frequency and urgency, 4) Business impact on key metrics, 5) Strategic alignment with company goals. Start with features that are high impact, low effort, and requested by multiple customers. Remember the 80/20 rule - focus on features that solve core problems for most users. Regular customer interviews and usage analytics should guide decisions more than internal opinions or competitor copying.",mentorship_needed,"### Instruction: How do I prioritize features when everything seems important?
### Response: Use a structured prioritization framework: 1) RICE scoring (Reach  Impact  Confidence  Effort), 2) Kano Model to distinguish must-haves from delighters, 3) Customer feedback frequency and urgency, 4) Business impact on key metrics, 5) Strategic alignment with company goals. Start with features that are high impact, low effort, and requested by multiple customers. Remember the 80/20 rule - focus on features that solve core problems for most users. Regular customer interviews and usage analytics should guide decisions more than internal opinions or competitor copying."
Our product has low user engagement despite good initial signup rates. How do we fix this?,,"Low engagement despite good signups suggests an onboarding or value realization problem. Investigate: 1) Time to value - how quickly do users see benefits?, 2) Onboarding friction - are there too many steps or confusing flows?, 3) Feature discovery - do users understand your core features?, 4) Value proposition alignment - does the product deliver on marketing promises?, 5) User segmentation - different user types may need different approaches. Implement user analytics, run usability tests, and interview both engaged and churned users. Focus on activation metrics and create guided onboarding experiences.",needs_refinement,"### Instruction: Our product has low user engagement despite good initial signup rates. How do we fix this?
### Response: Low engagement despite good signups suggests an onboarding or value realization problem. Investigate: 1) Time to value - how quickly do users see benefits?, 2) Onboarding friction - are there too many steps or confusing flows?, 3) Feature discovery - do users understand your core features?, 4) Value proposition alignment - does the product deliver on marketing promises?, 5) User segmentation - different user types may need different approaches. Implement user analytics, run usability tests, and interview both engaged and churned users. Focus on activation metrics and create guided onboarding experiences."
I got my first paying customer! What should I do next to build on this success?,,"Congratulations! This is a huge milestone. Now focus on: 1) Customer Success - Ensure your first customer gets maximum value and becomes a reference, 2) Case Study - Document their problem, solution, and results for marketing, 3) Feedback Loop - Schedule regular check-ins to gather product feedback, 4) Referrals - Ask for introductions to similar prospects, 5) Optimize Operations - Use this experience to refine your onboarding and delivery processes. Don't immediately focus on scaling - get 5-10 more customers using similar approaches first. Each early customer is a learning opportunity to refine your product-market fit.",mentorship_needed,"### Instruction: I got my first paying customer! What should I do next to build on this success?
### Response: Congratulations! This is a huge milestone. Now focus on: 1) Customer Success - Ensure your first customer gets maximum value and becomes a reference, 2) Case Study - Document their problem, solution, and results for marketing, 3) Feedback Loop - Schedule regular check-ins to gather product feedback, 4) Referrals - Ask for introductions to similar prospects, 5) Optimize Operations - Use this experience to refine your onboarding and delivery processes. Don't immediately focus on scaling - get 5-10 more customers using similar approaches first. Each early customer is a learning opportunity to refine your product-market fit."
We've hit $100K MRR and want to expand our team. What roles should we hire first?,,"At $100K MRR, you're entering a critical growth phase. Prioritize hiring based on your biggest constraints: 1) If sales is the bottleneck, hire a sales manager or BDRs, 2) If product development is slow, add senior engineers, 3) If customer success is suffering, hire a customer success manager, 4) If operations are chaotic, consider an operations manager. Generally, the sequence is: senior engineer  sales hire  customer success  marketing. Ensure each hire can pay for themselves within 6 months through increased revenue or efficiency. Focus on experienced hires who can work independently and eventually manage others.",investment_ready,"### Instruction: We've hit $100K MRR and want to expand our team. What roles should we hire first?
### Response: At $100K MRR, you're entering a critical growth phase. Prioritize hiring based on your biggest constraints: 1) If sales is the bottleneck, hire a sales manager or BDRs, 2) If product development is slow, add senior engineers, 3) If customer success is suffering, hire a customer success manager, 4) If operations are chaotic, consider an operations manager. Generally, the sequence is: senior engineer  sales hire  customer success  marketing. Ensure each hire can pay for themselves within 6 months through increased revenue or efficiency. Focus on experienced hires who can work independently and eventually manage others."
My co-founder wants to quit 6 months into our startup. How should I handle this situation?,,"This is a critical situation requiring careful handling: 1) Understand their reasons - is it personal, financial, or disagreement about direction?, 2) Review your founder agreements - what does your vesting schedule and equity documentation say?, 3) Consider alternatives - reduced role, advisory position, or leave of absence, 4) Protect the business - ensure IP assignments, non-compete clauses, and customer relationships are secure, 5) Plan transition - knowledge transfer, team communication, and operational continuity. If they're determined to leave, negotiate fairly on equity clawback and ensure a professional transition that maintains team morale and company reputation.",needs_refinement,"### Instruction: My co-founder wants to quit 6 months into our startup. How should I handle this situation?
### Response: This is a critical situation requiring careful handling: 1) Understand their reasons - is it personal, financial, or disagreement about direction?, 2) Review your founder agreements - what does your vesting schedule and equity documentation say?, 3) Consider alternatives - reduced role, advisory position, or leave of absence, 4) Protect the business - ensure IP assignments, non-compete clauses, and customer relationships are secure, 5) Plan transition - knowledge transfer, team communication, and operational continuity. If they're determined to leave, negotiate fairly on equity clawback and ensure a professional transition that maintains team morale and company reputation."
A big corporation wants to acquire us after just 12 months. Should we consider it?,,"Early acquisition offers require careful evaluation: 1) Valuation assessment - is the offer fair compared to your potential?, 2) Strategic fit - will the acquisition help you achieve your vision faster?, 3) Team considerations - what happens to your employees and culture?, 4) Financial analysis - compare immediate payout vs. long-term potential, 5) Market timing - could you build more value independently?. If the offer is substantial and aligns with your goals, it might make sense. However, if you believe you're building something transformative and the offer doesn't reflect that potential, consider it validation and keep building. Get multiple perspectives from advisors and ensure any decision aligns with your personal and professional goals.",investment_ready,"### Instruction: A big corporation wants to acquire us after just 12 months. Should we consider it?
### Response: Early acquisition offers require careful evaluation: 1) Valuation assessment - is the offer fair compared to your potential?, 2) Strategic fit - will the acquisition help you achieve your vision faster?, 3) Team considerations - what happens to your employees and culture?, 4) Financial analysis - compare immediate payout vs. long-term potential, 5) Market timing - could you build more value independently?. If the offer is substantial and aligns with your goals, it might make sense. However, if you believe you're building something transformative and the offer doesn't reflect that potential, consider it validation and keep building. Get multiple perspectives from advisors and ensure any decision aligns with your personal and professional goals."
How do I know if I should pivot or persevere?,,"The pivot vs persevere decision depends on key signals: 1) Customer engagement - are users actually using your product regularly?, 2) Growth rate - is organic growth accelerating or flattering?, 3) Market feedback - are customers asking for fundamental changes or just features?, 4) Founder conviction - do you still believe in the problem?, 5) Resource runway - how much time do you have to experiment?. Pivot if you're not seeing organic growth after 6+ months of iteration, customers don't seem to care when you go away, or you've lost conviction in the problem. Persevere if you're seeing slow but consistent growth, strong user engagement, and clear path to product-market fit.",needs_refinement,"### Instruction: How do I know if I should pivot or persevere?
### Response: The pivot vs persevere decision depends on key signals: 1) Customer engagement - are users actually using your product regularly?, 2) Growth rate - is organic growth accelerating or flattering?, 3) Market feedback - are customers asking for fundamental changes or just features?, 4) Founder conviction - do you still believe in the problem?, 5) Resource runway - how much time do you have to experiment?. Pivot if you're not seeing organic growth after 6+ months of iteration, customers don't seem to care when you go away, or you've lost conviction in the problem. Persevere if you're seeing slow but consistent growth, strong user engagement, and clear path to product-market fit."
What's the biggest mistake first-time founders make?,,"The biggest mistake is building a product without talking to customers first. Many founders fall in love with their solution and spend months building features nobody wants. Other critical mistakes include: 1) Perfectionism - launching too late with too many features, 2) Wrong co-founder choice - not aligning on vision and work ethic, 3) Ignoring unit economics - focusing on growth without understanding profitability, 4) Premature scaling - hiring and spending before finding product-market fit, 5) Not talking to users enough - making decisions based on assumptions rather than data. The antidote is customer obsession from day one.",mentorship_needed,"### Instruction: What's the biggest mistake first-time founders make?
### Response: The biggest mistake is building a product without talking to customers first. Many founders fall in love with their solution and spend months building features nobody wants. Other critical mistakes include: 1) Perfectionism - launching too late with too many features, 2) Wrong co-founder choice - not aligning on vision and work ethic, 3) Ignoring unit economics - focusing on growth without understanding profitability, 4) Premature scaling - hiring and spending before finding product-market fit, 5) Not talking to users enough - making decisions based on assumptions rather than data. The antidote is customer obsession from day one."
How do I build a great product culture in my startup?,,"Great product culture starts with customer obsession and data-driven decision making: 1) Make everyone customer-facing - engineers should talk to users regularly, 2) Ship fast and measure - prefer quick iterations over perfect launches, 3) Data transparency - make key metrics visible to everyone, 4) Customer feedback loops - built regular user research into your process, 5) Cross-functional collaboration - break down silos between teams, 6) Embrace failure - celebrate learning from experiments that don't work. The CEO should model this behavior and hire people who naturally think about customer impact. Product decisions should always start with 'how does this help our users?'",investment_ready,"### Instruction: How do I build a great product culture in my startup?
### Response: Great product culture starts with customer obsession and data-driven decision making: 1) Make everyone customer-facing - engineers should talk to users regularly, 2) Ship fast and measure - prefer quick iterations over perfect launches, 3) Data transparency - make key metrics visible to everyone, 4) Customer feedback loops - built regular user research into your process, 5) Cross-functional collaboration - break down silos between teams, 6) Embrace failure - celebrate learning from experiments that don't work. The CEO should model this behavior and hire people who naturally think about customer impact. Product decisions should always start with 'how does this help our users?'"
What do VCs really look for in early-stage startups?,,"VCs evaluate startups across several dimensions: 1) Market size - is this a $1B+ opportunity?, 2) Team quality - can these founders execute and scale?, 3) Product traction - evidence of product-market fit and growth, 4) Business model - clear path to significant revenue, 5) Competitive advantage - sustainable moats, 6) Timing - why now?, 7) Vision - can this become a category-defining company?. Early stage VCs weight team heavily - they bet on founders more than products. Show strong unit economics, consistent growth, and deep customer understanding. Most importantly, demonstrate you can build something customers love and will pay for.",investment_ready,"### Instruction: What do VCs really look for in early-stage startups?
### Response: VCs evaluate startups across several dimensions: 1) Market size - is this a $1B+ opportunity?, 2) Team quality - can these founders execute and scale?, 3) Product traction - evidence of product-market fit and growth, 4) Business model - clear path to significant revenue, 5) Competitive advantage - sustainable moats, 6) Timing - why now?, 7) Vision - can this become a category-defining company?. Early stage VCs weight team heavily - they bet on founders more than products. Show strong unit economics, consistent growth, and deep customer understanding. Most importantly, demonstrate you can build something customers love and will pay for."
How do I create a compelling pitch deck that stands out?,,"A compelling pitch deck tells a story in 10-12 slides: 1) Problem - paint a vivid picture of customer pain, 2) Solution - show your unique approach, 3) Market - size and growth potential, 4) Product - demo the core value, 5) Traction - prove customers want this, 6) Business Model - how you make money, 7) Competition - why you'll win, 8) Team - why you're the right people, 9) Financials - realistic projections, 10) Funding ask - specific use of funds. Keep it visual, tell stories not statistics, practice obsessively, and always end with a clear ask. The goal is to get a meeting, not close the deal in the deck.",investment_ready,"### Instruction: How do I create a compelling pitch deck that stands out?
### Response: A compelling pitch deck tells a story in 10-12 slides: 1) Problem - paint a vivid picture of customer pain, 2) Solution - show your unique approach, 3) Market - size and growth potential, 4) Product - demo the core value, 5) Traction - prove customers want this, 6) Business Model - how you make money, 7) Competition - why you'll win, 8) Team - why you're the right people, 9) Financials - realistic projections, 10) Funding ask - specific use of funds. Keep it visual, tell stories not statistics, practice obsessively, and always end with a clear ask. The goal is to get a meeting, not close the deal in the deck."
How do I maintain quality while scaling quickly?,,"Scaling while maintaining quality requires systematic approaches: 1) Document everything - create playbooks and standard operating procedures, 2) Implement quality controls - automated testing, peer reviews, customer feedback loops, 3) Hire for culture fit - people who naturally maintain high standards, 4) Create feedback systems - regular customer surveys, internal quality metrics, 5) Invest in tools and infrastructure - don't let technology be the bottleneck, 6) Scale incrementally - test processes with small groups before full rollout. The key is building quality into your processes rather than inspecting it in later. Plan for scale early but don't over-engineer before you need it.",investment_ready,"### Instruction: How do I maintain quality while scaling quickly?
### Response: Scaling while maintaining quality requires systematic approaches: 1) Document everything - create playbooks and standard operating procedures, 2) Implement quality controls - automated testing, peer reviews, customer feedback loops, 3) Hire for culture fit - people who naturally maintain high standards, 4) Create feedback systems - regular customer surveys, internal quality metrics, 5) Invest in tools and infrastructure - don't let technology be the bottleneck, 6) Scale incrementally - test processes with small groups before full rollout. The key is building quality into your processes rather than inspecting it in later. Plan for scale early but don't over-engineer before you need it."
