instruction,input,output,category,text
How do I validate my startup idea?,,"As a mentor, I'd recommend starting with customer discovery. Talk to at least 50 potential customers to validate your problem hypothesis. Document their pain points and willingness to pay for a solution.",mentorship_needed,"### Instruction: How do I validate my startup idea?
### Response: As a mentor, I'd recommend starting with customer discovery. Talk to at least 50 potential customers to validate your problem hypothesis. Document their pain points and willingness to pay for a solution."
What should I focus on in the early stages?,,Focus on building an MVP (Minimum Viable Product) first. This should be the simplest version that solves the core problem. Avoid feature bloat in the early stages.,mentorship_needed,"### Instruction: What should I focus on in the early stages?
### Response: Focus on building an MVP (Minimum Viable Product) first. This should be the simplest version that solves the core problem. Avoid feature bloat in the early stages."
How do I find my target market?,,"Conduct primary research through surveys, interviews, and observational studies. Use tools like Google Analytics, social media insights, and competitor analysis to understand your market.",mentorship_needed,"### Instruction: How do I find my target market?
### Response: Conduct primary research through surveys, interviews, and observational studies. Use tools like Google Analytics, social media insights, and competitor analysis to understand your market."
What are the key metrics I should track?,,"Track key metrics like customer acquisition cost (CAC), lifetime value (LTV), monthly recurring revenue (MRR), and churn rate. These will guide your decision-making.",mentorship_needed,"### Instruction: What are the key metrics I should track?
### Response: Track key metrics like customer acquisition cost (CAC), lifetime value (LTV), monthly recurring revenue (MRR), and churn rate. These will guide your decision-making."
How do I build a minimum viable product?,,"Start with a simple solution that addresses one core problem well. Use no-code tools, prototypes, or even manual processes to validate demand before building.",mentorship_needed,"### Instruction: How do I build a minimum viable product?
### Response: Start with a simple solution that addresses one core problem well. Use no-code tools, prototypes, or even manual processes to validate demand before building."
What mistakes should I avoid as a first-time entrepreneur?,,"Avoid perfectionism, building without customer input, ignoring cash flow, hiring too quickly, and neglecting legal foundations. Focus on learning and iteration.",mentorship_needed,"### Instruction: What mistakes should I avoid as a first-time entrepreneur?
### Response: Avoid perfectionism, building without customer input, ignoring cash flow, hiring too quickly, and neglecting legal foundations. Focus on learning and iteration."
How do I know if my idea is viable?,,"Test your assumptions through experiments. Look for strong customer demand, clear monetization path, scalable business model, and your ability to execute effectively.",mentorship_needed,"### Instruction: How do I know if my idea is viable?
### Response: Test your assumptions through experiments. Look for strong customer demand, clear monetization path, scalable business model, and your ability to execute effectively."
What resources do I need to get started?,,"You'll need domain expertise, basic financial understanding, network of advisors, minimal viable team, and sufficient runway to reach key milestones.",mentorship_needed,"### Instruction: What resources do I need to get started?
### Response: You'll need domain expertise, basic financial understanding, network of advisors, minimal viable team, and sufficient runway to reach key milestones."
How do I develop a business model?,,"Choose between B2B, B2C, subscription, marketplace, or freemium models based on your customer type and value delivery method. Test and iterate.",mentorship_needed,"### Instruction: How do I develop a business model?
### Response: Choose between B2B, B2C, subscription, marketplace, or freemium models based on your customer type and value delivery method. Test and iterate."
What legal considerations should I be aware of?,,"Register your business entity, understand tax obligations, protect intellectual property, draft founder agreements, and comply with industry regulations.",mentorship_needed,"### Instruction: What legal considerations should I be aware of?
### Response: Register your business entity, understand tax obligations, protect intellectual property, draft founder agreements, and comply with industry regulations."
How do I protect my intellectual property?,,"File for patents or trademarks if applicable, use non-disclosure agreements, document your IP creation process, and consider trade secret protection strategies.",mentorship_needed,"### Instruction: How do I protect my intellectual property?
### Response: File for patents or trademarks if applicable, use non-disclosure agreements, document your IP creation process, and consider trade secret protection strategies."
What should I include in my business plan?,,"Include executive summary, market analysis, competitive landscape, business model, financial projections, marketing strategy, team overview, and funding requirements.",mentorship_needed,"### Instruction: What should I include in my business plan?
### Response: Include executive summary, market analysis, competitive landscape, business model, financial projections, marketing strategy, team overview, and funding requirements."
How do I conduct market research?,,"Use both primary (surveys, interviews) and secondary research (industry reports, competitor analysis). Focus on market size, customer needs, and competitive positioning.",mentorship_needed,"### Instruction: How do I conduct market research?
### Response: Use both primary (surveys, interviews) and secondary research (industry reports, competitor analysis). Focus on market size, customer needs, and competitive positioning."
What tools can help me organize my startup?,,"Use project management tools like Notion or Asana, financial tracking with QuickBooks, customer relationship management systems, and communication platforms like Slack.",mentorship_needed,"### Instruction: What tools can help me organize my startup?
### Response: Use project management tools like Notion or Asana, financial tracking with QuickBooks, customer relationship management systems, and communication platforms like Slack."
How do I manage my time effectively as a founder?,,"Prioritize tasks using frameworks like RICE or MoSCoW, time-block your calendar, delegate effectively, and maintain work-life balance to prevent burnout.",mentorship_needed,"### Instruction: How do I manage my time effectively as a founder?
### Response: Prioritize tasks using frameworks like RICE or MoSCoW, time-block your calendar, delegate effectively, and maintain work-life balance to prevent burnout."
What skills do I need to develop?,,"Develop leadership, sales, financial literacy, product management, and communication skills. Consider taking courses or finding mentors in these areas.",mentorship_needed,"### Instruction: What skills do I need to develop?
### Response: Develop leadership, sales, financial literacy, product management, and communication skills. Consider taking courses or finding mentors in these areas."
How do I handle uncertainty and risk?,,"Build financial reserves, diversify revenue streams, create contingency plans, maintain strong relationships, and focus on learning from failures rather than avoiding them.",mentorship_needed,"### Instruction: How do I handle uncertainty and risk?
### Response: Build financial reserves, diversify revenue streams, create contingency plans, maintain strong relationships, and focus on learning from failures rather than avoiding them."
What are the different types of business structures?,,"Choose between sole proprietorship, LLC, corporation, or partnership based on liability protection, tax implications, growth plans, and investor requirements.",mentorship_needed,"### Instruction: What are the different types of business structures?
### Response: Choose between sole proprietorship, LLC, corporation, or partnership based on liability protection, tax implications, growth plans, and investor requirements."
How do I price my product or service?,,"Research competitor pricing, calculate your costs plus margin, test different price points, consider value-based pricing, and be prepared to iterate based on market feedback.",mentorship_needed,"### Instruction: How do I price my product or service?
### Response: Research competitor pricing, calculate your costs plus margin, test different price points, consider value-based pricing, and be prepared to iterate based on market feedback."
What are the essential elements of a startup?,,"Essential elements include a clear value proposition, viable business model, target market understanding, competitive advantage, founding team, and execution capability.",mentorship_needed,"### Instruction: What are the essential elements of a startup?
### Response: Essential elements include a clear value proposition, viable business model, target market understanding, competitive advantage, founding team, and execution capability."
How do I identify my competition?,,"As a mentor, I'd recommend starting with customer discovery. Talk to at least 50 potential customers to validate your problem hypothesis. Document their pain points and willingness to pay for a solution.",mentorship_needed,"### Instruction: How do I identify my competition?
### Response: As a mentor, I'd recommend starting with customer discovery. Talk to at least 50 potential customers to validate your problem hypothesis. Document their pain points and willingness to pay for a solution."
What is a value proposition?,,Focus on building an MVP (Minimum Viable Product) first. This should be the simplest version that solves the core problem. Avoid feature bloat in the early stages.,mentorship_needed,"### Instruction: What is a value proposition?
### Response: Focus on building an MVP (Minimum Viable Product) first. This should be the simplest version that solves the core problem. Avoid feature bloat in the early stages."
How do I create a user persona?,,"Conduct primary research through surveys, interviews, and observational studies. Use tools like Google Analytics, social media insights, and competitor analysis to understand your market.",mentorship_needed,"### Instruction: How do I create a user persona?
### Response: Conduct primary research through surveys, interviews, and observational studies. Use tools like Google Analytics, social media insights, and competitor analysis to understand your market."
What is the lean startup methodology?,,"Track key metrics like customer acquisition cost (CAC), lifetime value (LTV), monthly recurring revenue (MRR), and churn rate. These will guide your decision-making.",mentorship_needed,"### Instruction: What is the lean startup methodology?
### Response: Track key metrics like customer acquisition cost (CAC), lifetime value (LTV), monthly recurring revenue (MRR), and churn rate. These will guide your decision-making."
How do I test my assumptions?,,"Start with a simple solution that addresses one core problem well. Use no-code tools, prototypes, or even manual processes to validate demand before building.",mentorship_needed,"### Instruction: How do I test my assumptions?
### Response: Start with a simple solution that addresses one core problem well. Use no-code tools, prototypes, or even manual processes to validate demand before building."
What are the stages of startup development?,,"Avoid perfectionism, building without customer input, ignoring cash flow, hiring too quickly, and neglecting legal foundations. Focus on learning and iteration.",mentorship_needed,"### Instruction: What are the stages of startup development?
### Response: Avoid perfectionism, building without customer input, ignoring cash flow, hiring too quickly, and neglecting legal foundations. Focus on learning and iteration."
How do I build credibility for my startup?,,"Test your assumptions through experiments. Look for strong customer demand, clear monetization path, scalable business model, and your ability to execute effectively.",mentorship_needed,"### Instruction: How do I build credibility for my startup?
### Response: Test your assumptions through experiments. Look for strong customer demand, clear monetization path, scalable business model, and your ability to execute effectively."
What networking strategies should I use?,,"You'll need domain expertise, basic financial understanding, network of advisors, minimal viable team, and sufficient runway to reach key milestones.",mentorship_needed,"### Instruction: What networking strategies should I use?
### Response: You'll need domain expertise, basic financial understanding, network of advisors, minimal viable team, and sufficient runway to reach key milestones."
How do I manage startup stress?,,"Choose between B2B, B2C, subscription, marketplace, or freemium models based on your customer type and value delivery method. Test and iterate.",mentorship_needed,"### Instruction: How do I manage startup stress?
### Response: Choose between B2B, B2C, subscription, marketplace, or freemium models based on your customer type and value delivery method. Test and iterate."
What books should I read as an entrepreneur?,,"Register your business entity, understand tax obligations, protect intellectual property, draft founder agreements, and comply with industry regulations.",mentorship_needed,"### Instruction: What books should I read as an entrepreneur?
### Response: Register your business entity, understand tax obligations, protect intellectual property, draft founder agreements, and comply with industry regulations."
How do I prepare for Series A funding?,,"Prepare detailed financial projections, demonstrate strong unit economics, show consistent growth metrics, build a experienced team, and create a compelling growth story for investors.",investment_ready,"### Instruction: How do I prepare for Series A funding?
### Response: Prepare detailed financial projections, demonstrate strong unit economics, show consistent growth metrics, build a experienced team, and create a compelling growth story for investors."
What metrics do investors look for?,,"Investors focus on market size, revenue growth, customer retention, unit economics, team experience, competitive moats, and scalability potential. Ensure your metrics tell a compelling story.",investment_ready,"### Instruction: What metrics do investors look for?
### Response: Investors focus on market size, revenue growth, customer retention, unit economics, team experience, competitive moats, and scalability potential. Ensure your metrics tell a compelling story."
How do I create a compelling pitch deck?,,"Create a 10-12 slide deck covering problem, solution, market opportunity, business model, traction, competition, team, financials, funding ask, and use of funds.",investment_ready,"### Instruction: How do I create a compelling pitch deck?
### Response: Create a 10-12 slide deck covering problem, solution, market opportunity, business model, traction, competition, team, financials, funding ask, and use of funds."
What valuation should I expect?,,"Valuation depends on stage, traction, market size, and comparables. Early-stage companies typically trade at 10-20x revenue multiples, but this varies significantly by industry.",investment_ready,"### Instruction: What valuation should I expect?
### Response: Valuation depends on stage, traction, market size, and comparables. Early-stage companies typically trade at 10-20x revenue multiples, but this varies significantly by industry."
How do I negotiate with investors?,,"Understand your leverage, prepare multiple term sheet options, focus on more than just valuation, consider board composition and liquidation preferences carefully.",investment_ready,"### Instruction: How do I negotiate with investors?
### Response: Understand your leverage, prepare multiple term sheet options, focus on more than just valuation, consider board composition and liquidation preferences carefully."
What are the different types of funding?,,"Options include bootstrapping, angel investors, venture capital, crowdfunding, debt financing, grants, and strategic partnerships. Choose based on your stage and needs.",investment_ready,"### Instruction: What are the different types of funding?
### Response: Options include bootstrapping, angel investors, venture capital, crowdfunding, debt financing, grants, and strategic partnerships. Choose based on your stage and needs."
How do I find angel investors?,,"Network through industry events, accelerators, online platforms like AngelList, warm introductions from other entrepreneurs, and angel investor groups in your area.",investment_ready,"### Instruction: How do I find angel investors?
### Response: Network through industry events, accelerators, online platforms like AngelList, warm introductions from other entrepreneurs, and angel investor groups in your area."
What due diligence should I expect?,,"Expect review of financials, legal documents, customer references, technical architecture, IP portfolio, team backgrounds, and market analysis. Prepare comprehensive documentation.",investment_ready,"### Instruction: What due diligence should I expect?
### Response: Expect review of financials, legal documents, customer references, technical architecture, IP portfolio, team backgrounds, and market analysis. Prepare comprehensive documentation."
How do I scale my team effectively?,,"Hire for culture fit and growth potential, implement scalable HR processes, create clear role definitions, establish performance management systems, and maintain team cohesion.",investment_ready,"### Instruction: How do I scale my team effectively?
### Response: Hire for culture fit and growth potential, implement scalable HR processes, create clear role definitions, establish performance management systems, and maintain team cohesion."
What are the key performance indicators for growth?,,"Focus on North Star metrics like revenue, user growth, retention, NPS scores, market share, operational efficiency, and team performance indicators that drive long-term value.",investment_ready,"### Instruction: What are the key performance indicators for growth?
### Response: Focus on North Star metrics like revenue, user growth, retention, NPS scores, market share, operational efficiency, and team performance indicators that drive long-term value."
How do I expand to new markets?,,"Conduct thorough market research, adapt your product for local needs, establish local partnerships, understand regulatory requirements, and build region-specific marketing strategies.",investment_ready,"### Instruction: How do I expand to new markets?
### Response: Conduct thorough market research, adapt your product for local needs, establish local partnerships, understand regulatory requirements, and build region-specific marketing strategies."
What operational systems should I implement?,,"Implement ERP systems, standardize processes, create detailed documentation, establish quality controls, and build scalable customer support and fulfillment operations.",investment_ready,"### Instruction: What operational systems should I implement?
### Response: Implement ERP systems, standardize processes, create detailed documentation, establish quality controls, and build scalable customer support and fulfillment operations."
How do I maintain company culture during growth?,,"Document your values clearly, hire culture champions, create rituals and traditions, maintain transparent communication, and ensure leadership models desired behaviors consistently.",investment_ready,"### Instruction: How do I maintain company culture during growth?
### Response: Document your values clearly, hire culture champions, create rituals and traditions, maintain transparent communication, and ensure leadership models desired behaviors consistently."
What financial controls do I need?,,"Implement financial planning software, establish approval workflows, create detailed budgets and forecasts, maintain strong audit trails, and separate duties appropriately.",investment_ready,"### Instruction: What financial controls do I need?
### Response: Implement financial planning software, establish approval workflows, create detailed budgets and forecasts, maintain strong audit trails, and separate duties appropriately."
How do I manage cash flow during scaling?,,"Create detailed cash flow forecasts, maintain sufficient reserves, optimize payment terms, implement efficient collections, and establish credit facilities before you need them.",investment_ready,"### Instruction: How do I manage cash flow during scaling?
### Response: Create detailed cash flow forecasts, maintain sufficient reserves, optimize payment terms, implement efficient collections, and establish credit facilities before you need them."
What partnerships should I consider?,,"Consider strategic partnerships for distribution, technology integrations, co-marketing opportunities, or complementary product offerings that enhance your value proposition.",investment_ready,"### Instruction: What partnerships should I consider?
### Response: Consider strategic partnerships for distribution, technology integrations, co-marketing opportunities, or complementary product offerings that enhance your value proposition."
How do I optimize my sales funnel?,,"Analyze each funnel stage, A/B test improvements, implement marketing automation, optimize conversion points, and focus on reducing friction in the customer journey.",investment_ready,"### Instruction: How do I optimize my sales funnel?
### Response: Analyze each funnel stage, A/B test improvements, implement marketing automation, optimize conversion points, and focus on reducing friction in the customer journey."
What technology infrastructure do I need?,,"Build cloud-native architecture, implement robust security, create scalable databases, establish DevOps practices, and ensure high availability and disaster recovery capabilities.",investment_ready,"### Instruction: What technology infrastructure do I need?
### Response: Build cloud-native architecture, implement robust security, create scalable databases, establish DevOps practices, and ensure high availability and disaster recovery capabilities."
How do I handle international expansion?,,"Develop local market entry strategies, establish legal entities, understand cultural differences, build local teams, and adapt your product for international markets.",investment_ready,"### Instruction: How do I handle international expansion?
### Response: Develop local market entry strategies, establish legal entities, understand cultural differences, build local teams, and adapt your product for international markets."
What exit strategies should I consider?,,"Consider IPO, acquisition, or management buyout based on your goals, market conditions, and business performance. Prepare years in advance for any exit strategy.",investment_ready,"### Instruction: What exit strategies should I consider?
### Response: Consider IPO, acquisition, or management buyout based on your goals, market conditions, and business performance. Prepare years in advance for any exit strategy."
How do I prepare for an IPO?,,"Prepare detailed financial projections, demonstrate strong unit economics, show consistent growth metrics, build a experienced team, and create a compelling growth story for investors.",investment_ready,"### Instruction: How do I prepare for an IPO?
### Response: Prepare detailed financial projections, demonstrate strong unit economics, show consistent growth metrics, build a experienced team, and create a compelling growth story for investors."
What are the risks of rapid scaling?,,"Investors focus on market size, revenue growth, customer retention, unit economics, team experience, competitive moats, and scalability potential. Ensure your metrics tell a compelling story.",investment_ready,"### Instruction: What are the risks of rapid scaling?
### Response: Investors focus on market size, revenue growth, customer retention, unit economics, team experience, competitive moats, and scalability potential. Ensure your metrics tell a compelling story."
How do I maintain product quality during growth?,,"Create a 10-12 slide deck covering problem, solution, market opportunity, business model, traction, competition, team, financials, funding ask, and use of funds.",investment_ready,"### Instruction: How do I maintain product quality during growth?
### Response: Create a 10-12 slide deck covering problem, solution, market opportunity, business model, traction, competition, team, financials, funding ask, and use of funds."
What customer retention strategies work best?,,"Valuation depends on stage, traction, market size, and comparables. Early-stage companies typically trade at 10-20x revenue multiples, but this varies significantly by industry.",investment_ready,"### Instruction: What customer retention strategies work best?
### Response: Valuation depends on stage, traction, market size, and comparables. Early-stage companies typically trade at 10-20x revenue multiples, but this varies significantly by industry."
How do I build strategic partnerships?,,"Understand your leverage, prepare multiple term sheet options, focus on more than just valuation, consider board composition and liquidation preferences carefully.",investment_ready,"### Instruction: How do I build strategic partnerships?
### Response: Understand your leverage, prepare multiple term sheet options, focus on more than just valuation, consider board composition and liquidation preferences carefully."
